{
  "schemaVersion": "chromalab.benchmark.prediction.v1",
  "caseId": "phase9j_bench_06_photo_two_graphs_page_model_enabled",
  "runId": "bench_06_photo_two_graphs_page_20260526_185754",
  "mode": "e2b_baseline",
  "pipelineVersion": "phase9j-truth-audit",
  "reportGate": "REVIEW_ONLY",
  "validatorVerdict": "PASS",
  "runtimeFailureClass": "UNKNOWN_FAILURE",
  "firstFailingStage": "",
  "graphs": [
    {
      "graphId": "graph_1",
      "layoutClass": "DENSE_PEAK_SINGLE_AXIS",
      "graphPanelStatus": "VALID",
      "plotAreaStatus": "VALID",
      "calibration": {
        "xStatus": "REVIEW",
        "yStatus": "REVIEW",
        "xAnchorCount": 0,
        "yAnchorCount": 0
      },
      "trace": {
        "status": "REVIEW",
        "pointCount": 0,
        "xCoverageRatio": 0.0,
        "maxGapColumns": 0
      },
      "peaks": {
        "status": "REVIEW",
        "peakCount": 1,
        "reportablePeakCount": 0,
        "reviewPeakCount": 1,
        "rejectedPeakCount": 0
      },
      "failureSubreasons": [
        "Produces report/peaks but evidence gate remains review-grade; not release-ready.",
        "UNKNOWN_FAILURE"
      ]
    }
  ],
  "artifacts": {
    "runtimeEvidencePackage": "artifacts/phase9i-final-android/bench_06_photo_two_graphs_page/model_enabled/bench_06_photo_two_graphs_page_20260526_185754/runtime_evidence_package_run_1779811202522.json",
    "validatorJson": "artifacts/phase9i-final-android/bench_06_photo_two_graphs_page/model_enabled/bench_06_photo_two_graphs_page_20260526_185754/runtime_evidence_validation_run_1779811202522.json",
    "validatorMarkdown": "artifacts/phase9i-final-android/bench_06_photo_two_graphs_page/model_enabled/bench_06_photo_two_graphs_page_20260526_185754/runtime_evidence_validation_run_1779811202522.md",
    "finalReportJson": "artifacts/phase9i-final-android/bench_06_photo_two_graphs_page/model_enabled/bench_06_photo_two_graphs_page_20260526_185754/final_report_contract_run_1779811202522.json",
    "htmlReport": "artifacts/phase9i-final-android/bench_06_photo_two_graphs_page/model_enabled/bench_06_photo_two_graphs_page_20260526_185754/report_run_1779811202522.html",
    "markdownReport": "artifacts/phase9i-final-android/bench_06_photo_two_graphs_page/model_enabled/bench_06_photo_two_graphs_page_20260526_185754/report_run_1779811202522.md",
    "overlayPaths": [
      "artifacts/phase9i-final-android/bench_06_photo_two_graphs_page/model_enabled/bench_06_photo_two_graphs_page_20260526_185754/graph_1_graph_panel_overlay.png",
      "artifacts/phase9i-final-android/bench_06_photo_two_graphs_page/model_enabled/bench_06_photo_two_graphs_page_20260526_185754/graph_1_plot_area_overlay.png",
      "artifacts/phase9i-final-android/bench_06_photo_two_graphs_page/model_enabled/bench_06_photo_two_graphs_page_20260526_185754/graph_1_axis_tick_overlay.png",
      "artifacts/phase9i-final-android/bench_06_photo_two_graphs_page/model_enabled/bench_06_photo_two_graphs_page_20260526_185754/graph_1_trace_overlay.png",
      "artifacts/phase9i-final-android/bench_06_photo_two_graphs_page/model_enabled/bench_06_photo_two_graphs_page_20260526_185754/graph_1_peak_overlay.png"
    ]
  },
  "timingsMs": {
    "total": 0.0
  }
}
