{
  "schemaVersion": "chromalab.benchmark.prediction.v1",
  "caseId": "phase9j_bench_03_small_tic_export_model_enabled",
  "runId": "bench_03_small_tic_export_20260526_185008",
  "mode": "e2b_baseline",
  "pipelineVersion": "phase9j-truth-audit",
  "reportGate": "REVIEW_ONLY",
  "validatorVerdict": "PASS",
  "runtimeFailureClass": "PEAK_EVIDENCE_FAILURE",
  "firstFailingStage": "",
  "graphs": [
    {
      "graphId": "graph_1",
      "layoutClass": "SINGLE_TRACE_SINGLE_AXIS",
      "graphPanelStatus": "VALID",
      "plotAreaStatus": "VALID",
      "calibration": {
        "xStatus": "REVIEW",
        "yStatus": "REVIEW",
        "xAnchorCount": 0,
        "yAnchorCount": 0
      },
      "trace": {
        "status": "REVIEW",
        "pointCount": 0,
        "xCoverageRatio": 0.0,
        "maxGapColumns": 0
      },
      "peaks": {
        "status": "REVIEW",
        "peakCount": 3,
        "reportablePeakCount": 0,
        "reviewPeakCount": 3,
        "rejectedPeakCount": 0
      },
      "failureSubreasons": [
        "PEAK_EVIDENCE_FAILURE",
        "Produces report/peaks but evidence gate remains review-grade; not release-ready."
      ]
    }
  ],
  "artifacts": {
    "runtimeEvidencePackage": "artifacts/phase9i-final-android/bench_03_small_tic_export/model_enabled/bench_03_small_tic_export_20260526_185008/runtime_evidence_package_run_1779810632948.json",
    "validatorJson": "artifacts/phase9i-final-android/bench_03_small_tic_export/model_enabled/bench_03_small_tic_export_20260526_185008/runtime_evidence_validation_run_1779810632948.json",
    "validatorMarkdown": "artifacts/phase9i-final-android/bench_03_small_tic_export/model_enabled/bench_03_small_tic_export_20260526_185008/runtime_evidence_validation_run_1779810632948.md",
    "finalReportJson": "artifacts/phase9i-final-android/bench_03_small_tic_export/model_enabled/bench_03_small_tic_export_20260526_185008/final_report_contract_run_1779810632948.json",
    "htmlReport": "artifacts/phase9i-final-android/bench_03_small_tic_export/model_enabled/bench_03_small_tic_export_20260526_185008/report_run_1779810632948.html",
    "markdownReport": "artifacts/phase9i-final-android/bench_03_small_tic_export/model_enabled/bench_03_small_tic_export_20260526_185008/report_run_1779810632948.md",
    "overlayPaths": [
      "artifacts/phase9i-final-android/bench_03_small_tic_export/model_enabled/bench_03_small_tic_export_20260526_185008/graph_1_graph_panel_overlay.png",
      "artifacts/phase9i-final-android/bench_03_small_tic_export/model_enabled/bench_03_small_tic_export_20260526_185008/graph_1_plot_area_overlay.png",
      "artifacts/phase9i-final-android/bench_03_small_tic_export/model_enabled/bench_03_small_tic_export_20260526_185008/graph_1_axis_tick_overlay.png",
      "artifacts/phase9i-final-android/bench_03_small_tic_export/model_enabled/bench_03_small_tic_export_20260526_185008/graph_1_trace_overlay.png",
      "artifacts/phase9i-final-android/bench_03_small_tic_export/model_enabled/bench_03_small_tic_export_20260526_185008/graph_1_peak_overlay.png"
    ]
  },
  "timingsMs": {
    "total": 0.0
  }
}
